Country,Comment,URL,Year,NumAuth,Agency,ReportSeries,Branch,FirstAuthor,AllAuthors,Citation,Title,Date,Vol
Scotland,,,1991,1,Fisheries Research Services,Internal Reports,,,"Ferro, R.S.T.",,Selection and catch comparison trials of seine net cod-ends on MFV Kestrel - April 1990. (03/91) [no document available],01/01/1991,
Scotland,,,1991,2,Fisheries Research Services,Internal Reports,,,"Main, J. & Sangster, G.I.",,A different approach to covered cod-end selection experiments. (04/91) [no document available],01/01/1991,
Scotland,,,1991,4,Fisheries Research Services,Internal Reports,,,"Smith, G.W.; Johnstone, A.D.F.; Sarno, B. & Robb, C.",,Catches of Atlantic salmon ( Salmo salar L.) in a sweep net fishery operation in the Don estuary. (05/91) [no document available],01/01/1991,
Scotland,,,1991,2,Fisheries Research Services,Internal Reports,,,"Main, J. & Sangster, G.I.",,The use of scaring devices in cod-ends to enhance fish escape. (06/91) [no document available],01/01/1991,
Scotland,,,1991,4,Fisheries Research Services,Internal Reports,,,"Shanks, A.M.; Bruno, D.W.; Mitchell, G.G. & Munro, A.L.S.",,The use of Aquagard and the prevalence of cataracts among farmed Atlantic salmon ( Salmo salar L.). (07/91) [no document available],01/01/1991,
Scotland,,,1991,2,Fisheries Research Services,Internal Reports,,,"McHenery, J.G. and Forsyth, S.W.",,Effects of dichlorvos exposure on acetylcholinesterase levels of lobster larvae and mussels deployed in the vicinity of a salmon farm. (08/91),01/01/1991,
Scotland,,,1991,2,Fisheries Research Services,Internal Reports,,,"Davies, I.M. & McKay, D.W.",,"Farmed shellfish production in Scotland, 1990. (09/91) [no document available]",01/01/1991,
Scotland,,,1991,2,Fisheries Research Services,Internal Reports,,,"Davies, I.M. & Shanks, A.M.",,"Geographical distribution of catches of shellfish landed by UK vessels at Scottish ports, 1990. (10/91) [no document available]",01/01/1991,
Scotland,,,1991,2,Fisheries Research Services,Internal Reports,,,"Davies, I.M. & Topping, G.",,Recent determination of the concentrations of cadmium in scallops from northern Scotland. (11/91) [no document available],01/01/1991,
Scotland,,,1991,1,Fisheries Research Services,Internal Reports,,,"Hall, C.D.",,The effects of seismic exploration and underwater explosions on marine life: a bibliography. (12/91) [no document available],01/01/1991,
Scotland,,,1991,2,Fisheries Research Services,Internal Reports,,,"Main, J. & Galbraith, R.D.",,Selective industrial fishing trawl (Sift) for Norway full scale development trials - FRV Clupea March/April 1991. (13/91) [no document available],01/01/1991,
Scotland,,,1991,1,Fisheries Research Services,Internal Reports,,,"Mowat, M.J.D.",,Notes on using the Maps program on VAX computers. (14/91) [no document available],01/01/1991,
Scotland,,,1991,3,Fisheries Research Services,Internal Reports,,,"Davies, I.M.; Turrell, W.R. & Wells, D.E.",,"The observation and simulation to the dispersion of DDVP in Loch Ailort, August 1990. (15/91) [no document available]",01/01/1991,
Scotland,,,1991,3,Fisheries Research Services,Internal Reports,,,"McHenery, J.G.; Linley Adams, G.E. & Moore, D.C.",,"Effects of dichlorvos exposure on the acetylcholinesterase levels of the gills of the mussels, Mytilus edulis L., experimental and field studies. (16/91) [no document available]",01/01/1991,
Scotland,,,1991,4,Fisheries Research Services,Internal Reports,,,"Robertson, N.A.; Murison, D.J.; Moore, D.C. & McHenery, J.G.",,Studies of invertebrate assemblages associated with seaweeds on rocky shores adjacent to salmon farm cages in Scottish sea lochs. (17/91) [no document available],01/01/1991,
Scotland,,,1991,2,Fisheries Research Services,Internal Reports,,,"Main, J. & Sangster, G.I.",,A study of haddock ( Merlanogrammus aeglifinus (L.)) behaviour in diamond and square mesh cod-ends. (18/91) [no document available],01/01/1991
Scotland,,,1991,2,Fisheries Research Services,Internal Reports,,,"Main, J. & Sangster, G.I.",,A study of haddock ( Merlanogrammus aeglifinus (L.)) behaviour in diamond and square mesh cod-ends. (19/91) [no document available],01/01/1991
Scotland,,,1991,3,Fisheries Research Services,Internal Reports,,,"Rodger, G.K.; Brown, F.M.J. & Davies, I.M.",,JMG purpose a report: mercury in fin and shellfish landed at Scottish ports. (20/91) [no document available],01/01/1991
Scotland,,,1991,1,Fisheries Research Services,Internal Reports,,,"Brown, F.M.J.",,Six monthly survey of mercury concentrations in exported fish and shellfish species. Current values: spring 1991. (21/91) [no document available],01/01/1991
Scotland,,,1991,2,Fisheries Research Services,Internal Reports,,,"Mackie, A.M. & Johnstone, A.D.F.",,"Carotenoid pigments in saithe, Pollachius virens (L.) from the vicinity of salmon farm cages. (22/91) [no document available]",01/01/1991
Scotland,,,1991,4,Fisheries Research Services,Internal Reports,,,"Rodger, G.K.; Davies, I.M.; Armstrong, F. & Glass, C.W.",,"Remote sensing studies of the movement of sewage sludge at Garroch Head disposal site, Firth of Clyde, Scotland. (23/91) [no document available]",01/01/1991
Scotland,,,1991,3,Fisheries Research Services,Internal Reports,,,"Rodger, G.K.; Davies, I.M. & Moore, D.C.",,The long term effects on the sediment at a sewage sludge dump site following the cessation of dumping. (24/91) [no document available],01/01/1991
Scotland,,,1991,2,Fisheries Research Services,Internal Reports,,,"Rankine, P.W. & Cargill, L.H.",,The automated measurement of growth increments of larval fish otoliths using image analysis enhancement procedures. (25/91) [no document available],01/01/1991
Scotland,,,1991,2,Fisheries Research Services,Internal Reports,,,"Wells, D.E. & Kelly, A.G.",,Organochlorine residues in sea mammals from the northeastern coast of Scotland. (26/91) [no document available],01/01/1991
Scotland,,,1991,4,Fisheries Research Services,Internal Reports,,,"Bailey, N.; Howell, T.; Chapman, C.J. & Thain, S.E.B.",,Solway cockle surveys 1990. (27/91) [no document available],01/01/1991
Scotland,,,1991,1,Fisheries Research Services,Internal Reports,,,"Brown, F.M.J.",,Six monthly survey of mercury concentrations in exported fish and shellfish special. current values: Autumn 1991. (01/92) [no document available],01/01/1991
Scotland,,,1991,4,Fisheries Research Services,Internal Reports,,,"Main, J.; Sangster, G.I.; Kynoch, R.J. & Ferro, R.S.T.",,An experiment to measure the selectivity of cod-ends using two designs of cover. (02/92) [no document available],01/01/1991
Scotland,,,1991,UFO,Fisheries Research Services,Internal Reports,,,Marine Pollution Monitoring Group,,Final report of the MPMMG subgroup on marine fish farming. (03/92) [no document available],01/01/1991
Scotland,,http://www.scotland.gov.uk/Uploads/Documents/INT244.pdf,1991,3,Fisheries Research Services,Internal Reports,,,"Harding, M.J.C.; Bailey, S.K. & Davies, I.M.",,UK Department of the Environment TBT Imposex Survey of the North Sea Contract PECD 7/8/214 Annex 4: Germany. (13/92),01/01/1991
Scotland,,http://www.scotland.gov.uk/Uploads/Documents/sfwp4-92.pdf,1992,1,Fisheries Research Services,Internal Reports,,,"O'Neill, F.G.",,Derivation of equations governing cod-ends geometry. (04/92),01/01/1992
Scotland,,,1992,2,Fisheries Research Services,Internal Reports,,,"Turrell, W.G. & Slessor, G.",,Annual cycles of physical chemical and biological parameters. (05/92) [no document available],01/01/1992
Scotland,,,1992,2,Fisheries Research Services,Internal Reports,,,"Robertson, J.H.B. & Leaver, I.D.",,A test of the twin trawl system for catch comparison. (06/92) [no document available],01/01/1992
Scotland,,,1992,2,Fisheries Research Services,Internal Reports,,,"Pirie, J. & McRae, L.",,Six monthly survey of mercury concentrations in exported fish and shellfish species current values: Spring 1992. (07/92) [no document available],01/01/1992
Scotland,,,1992,1,Fisheries Research Services,Internal Reports,,,"Galbraith, R.D.",,Swept volume comparisons of the principle Scottish demersal gears. (08/92) [no document available],01/01/1992
Scotland,,,1992,3,Fisheries Research Services,Internal Reports,,,"Harding, M.J.C.; Bailey, S.K. & Davies, I.M.",,UK Department of the Environment TBT Imposex Survey of the North Sea Contract PECD 7/8/214. (09/92) [no document available],01/01/1992
Scotland,,,1992,3,Fisheries Research Services,Internal Reports,,,"Harding, M.J.C.; Bailey, S.K. & Davies, I.M.",,UK Department of the Environment TBT Imposex Survey of the North Sea Contract PECD 7/8/214 Annex 1: Norway. (10/92) [no document available],01/01/1992
Scotland,,,1992,3,Fisheries Research Services,Internal Reports,,,"Harding, M.J.C.; Bailey, S.K. & Davies, I.M.",,UK Department of the Environment TBT Imposex Survey of the North Sea Contract PECD 7/8/214 Annex 2: Sweden. (11/92) [no document available],01/01/1992
Scotland,,,1992,3,Fisheries Research Services,Internal Reports,,,"Harding, M.J.C.; Bailey, S.K. & Davies, I.M.",,UK Department of the Environment TBT Imposex Survey of the North Sea Contract PECD 7/8/214 Annex 3: Denmark. (12/92) [no document available],01/01/1992
Scotland,,,1992,3,Fisheries Research Services,Internal Reports,,,"Harding, M.J.C.; Bailey, S.K. & Davies, I.M.",,UK Department of the Environment TBT Imposex Survey of the North Sea Contract PECD 7/8/214 Annex 5: Netherlands. (14/92) [no document available],01/01/1992
Scotland,,,1992,3,Fisheries Research Services,Internal Reports,,,"Harding, M.J.C.; Bailey, S.K. & Davies, I.M.",,UK Department of the Environment TBT Imposex Survey of the North Sea Contract PECD 7/8/214 Annex 6: Belgium. (15/92) [no document available],01/01/1992
Scotland,,,1992,3,Fisheries Research Services,Internal Reports,,,"Harding, M.J.C.; Bailey, S.K. & Davies, I.M.",,UK Department of the Environment TBT Imposex Survey of the North Sea Contract PECD 7/8/214 Annex 7: France. (16/92) [no document available],01/01/1992
Scotland,,,1992,3,Fisheries Research Services,Internal Reports,,,"Harding, M.J.C.; Bailey, S.K. & Davies, I.M.",,UK Department of the Environment TBT Imposex Survey of the North Sea Contract PECD 7/8/214 Annex 8: United Kingdom. (17/92) [no document available],01/01/1992
Scotland,,,1992,3,Fisheries Research Services,Internal Reports,,,"Davies, I.M., Bailey, S.K. & Harding, M.J.C.",,UK Department of the Environment TBT Imposex Survey of the North Sea Contract PECD 7/8/214 Annex 18. (18/92) [no document available],01/01/1992
Scotland,,,1992,4,Fisheries Research Services,Internal Reports,,,"Bailey, N.; Howell, T.; Chapman, C.J. & Thain, S.E.B.",,SOAFD Solway cockle survey 1991. (19/92) [no document available],01/01/1992
Scotland,,,1993,1,Fisheries Research Services,Internal Reports,,,"Brown, F.M.J.",,Six monthly survey of mercury concentrations in exported fish and shellfish species. Current values: Autumn 1992. (01/93) [no document available],01/01/1993
Scotland,,,1993,1,Fisheries Research Services,Internal Reports,,,"Kynoch, R.J.",,Stuarts of Musselburgh Twin Crown Trawl - engineering performance and observations. (02/93) [no document available],01/01/1993
Scotland,,,1993,3,Fisheries Research Services,Internal Reports,,,"Balls, P.W.; Brown, F.M.J. & Campbell, L.A.",,Nutrient distributions in nine Scottish east coast estuaries. (03/93) [no document available],01/01/1993
Scotland,,,1993,4,Fisheries Research Services,Internal Reports,,,"Gillibrand, P.A.; Turrell, W.R.; Payne, R. & Adams, R.D.",,Loch Sunart hydrographic surveys 1987-1990 current meter data report. (04/93) [no document available],01/01/1993
Scotland,,,1993,1,Fisheries Research Services,Internal Reports,,,"Hall, C.D.",,The effects of seismic exploration and underwater explosions on marine life: a bibliography. (05/93) [no document available],01/01/1993
Scotland,,,1993,2,Fisheries Research Services,Internal Reports,,,"Brown, F.M.J. & Rowe, B.",,Six monthly survey of mercury concentrations in explorted fish and shellfish species. Current values: Spring 1993. (06/93) [no document available],01/01/1993
Scotland,,,1994,5,Fisheries Research Services,Internal Reports,,,"McKay, D.W.; Howell, T.; Shanks, A.; Thain, S.E.B. & Keith, F.",,Report on cockle stocks in the Findhorn Bay/Nairn area. (01/94) [no document available],01/01/1994
Scotland,,,1994,2,Fisheries Research Services,Internal Reports,,,"Robertson, J.H.B. & Shanks, A.M.",,Analysis of fishing trials using the twin trawl system of nets with windows of square mesh. (02/94) [no document available],01/01/1994
Scotland,,,1994,4,Fisheries Research Services,Internal Reports,,,"Wells, D.W.; Finlayson, D.M.; Horton, C. & Robson, J.H.",,"Distribution of dichlorvos and rhodamine B in fish cages and surrounding water resulting from the treatment of Atlantic salmon infested with sea louse ( Lepeophtherus salmonis) in Glenmore Bay, Loch Sunart. (03/94) [no document available]",01/01/1994
Scotland,,,1994,2,Fisheries Research Services,Internal Reports,,,"Wells, D.W.; Finlayson, D.M.",,"Uptake and depuration of dichlorvos by the mussel, Mytilus Edulis L., in experimental studies. (04/94) [no document available]",01/01/1994
Scotland,,,1994,3,Fisheries Research Services,Internal Reports,,,"Smith, G.W.; Sarno, B. & Urquhart, G.G.",,Field managements of the errors associated with ultrasonic tracking using a fixed hydrophone array. (05/94) [no document available],01/01/1994
Scotland,,,1994,4,Fisheries Research Services,Internal Reports,,,"Brewer, M.J.; Galbraith, R.D.; Fryer, R.J. & Ferro, R.S.T.",,"Haul-by-haul analysis of pair seine cod-end selection data MV Liberty and Fulmar, September 1993. (06/94) [no document available]",01/01/1994
Scotland,,,1994,4,Fisheries Research Services,Internal Reports,,,"Chapman, C.J.; Howell, T.R.W.; Bailey, N. & Thain, S.E.B.",,SOAFD Solway cockle survey 1992-1993. (07/94) [no document available],01/01/1994
Scotland,,,1994,4,Fisheries Research Services,Internal Reports,,,"Howell, T.R.W.; McKay, D.W.; Chapman, C.J. & Thain, S.E.B.",,SOAFD Solway cockle survey 1994. (08/94) [no document available],01/01/1994
Scotland,,,1994,2,Fisheries Research Services,Internal Reports,,,"Gillibrand, P.A. & Adams, R.D.",,Measurement of Richardson numbers in two Scottish sea lochs. (09/94) [no document available],01/01/1994
Scotland,,,1995,UFO,Fisheries Research Services,Internal Reports,,,Anon,,"Report of Marine Laboratory scallop workshop, 1994. (01/95) [no document available]",01/01/1995
Scotland,,http://www.scotland.gov.uk/Uploads/Documents/sfwp295.pdf,1995,1,Fisheries Research Services,Internal Reports,,,"Smith, I.P.",,Preliminary assessment of the influence of tide on movements of salmon into the lower River Dee (Grampian Region) as determined by an automatic fish counter. (02/95),01/01/1995
Scotland,,,1995,3,Fisheries Research Services,Internal Reports,,,"Gosden, S.J.; Stewart, P.A.M. & Newton, A.W.",,Assessment of the effects on discard rates of introducing square mesh panels in the Scottish Nephrops trawl fishery. (03/95) [no document available],01/01/1995
Scotland,,,1995,2,Fisheries Research Services,Internal Reports,,,"O'Neill, F.G. & Kynoch, R.J.",,The effect of cover mesh size and cod-end catch size on cod-end selectivity. (04/95) [no document available],01/01/1995
Scotland,,,1995,2,Fisheries Research Services,Internal Reports,,,"Turrell, W.R. & Ketcher, D.J.",,CTD raw data description from the 1994 L'Espoir North Atlantic survey. (05/95) [no document available],01/01/1995
Scotland,,,1995,2,Fisheries Research Services,Internal Reports,,,"Turrell, W.R. & Adams, R.D.",,Raw hydrographic data and CTD calibration details from the 1994 L'Espoir North Atlantic survey. (06/95) [no document available],01/01/1995
Scotland,,,1995,4,Fisheries Research Services,Internal Reports,,,"Howell, T.R.W.; Chapman, C.J.; Thain, S.E.B. & Hawkins, M.",,Survey of Solway cockle grounds 1995. (07/95) [no document available],01/01/1995
Scotland,,,1995,3,Fisheries Research Services,Internal Reports,,,"Harding, M.J.C.; Bailey, S.K. & Davies, I.M.",,"Effect of TBT on the reproductive success of the dogwhelk, Nucella lapillus. (08/95) [no document available]",01/01/1995
Scotland,,http://www.scotland.gov.uk/Uploads/Documents/IR0296.pdf,1995,1,Fisheries Research Services,Internal Reports,,,"Slessor, G.",,A DOS application for thermo-salinograph and fluorometer data capture viewing and editing processing routines. (09/95),01/01/1995
Scotland,,http://www.scotland.gov.uk/Uploads/Documents/IR0196.pdf,1996,3,Fisheries Research Services,Internal Reports,,,"Wells, D.E.; McKenzie, C. & Ross, H.M.",,Chlorobiphenyl patterns in marine mammals from northern European waters. (01/96),01/01/1996
Scotland,,http://www.scotland.gov.uk/Uploads/Documents/IR0296.pdf,1996,1,Fisheries Research Services,Internal Reports,,,"Slessor, G.",,A DOS application for processing and displaying Aanderaa instrument data. (02/96),01/01/1996
Scotland,,http://www.scotland.gov.uk/Uploads/Documents/IR0396.pdf,1996,1,Fisheries Research Services,Internal Reports,,,"Payne, R.",,Help on mooring procedures. (03/96),01/01/1996
Scotland,,http://www.scotland.gov.uk/Uploads/Documents/IR0496.pdf,1996,4,Fisheries Research Services,Internal Reports,,,"Howell, T.R.W.; Chapman, C.J.; Thain, S.E.B. & Hawkins, M.",,Survey of Solway cockle grounds 1996. (04/96),01/01/1996
Scotland,,http://www.scotland.gov.uk/Uploads/Documents/1-97.pdf,1997,3,Fisheries Research Services,Internal Reports,,,"Shanks, A.; Robertson, J. & Bova, D.",,Trials of creels fitted with an escape gap in a fishery for velvet swimming crabs ( Necora puber). (01/97),01/01/1997
Scotland,,http://www.scotland.gov.uk/Uploads/Documents/IR0297.pdf,1997,1,Fisheries Research Services,Internal Reports,,,"Kynoch, R.J.",,Engineering performance of three Scottish demersal trawling gears used in ICES sub area VIA. (02/97),01/01/1997
Scotland,,http://www.scotland.gov.uk/Uploads/Documents/IR0397.pdf,1997,2,Fisheries Research Services,Internal Reports,,,"Gillibrand, P.A. & Turrell, W.R.",,Simulating the dispersion and setting of particulate material and associated substances from salmon farms. (03/97),01/01/1997
Scotland,,http://www.scotland.gov.uk/Uploads/Documents/IR0497.pdf,1997,2,Fisheries Research Services,Internal Reports,,,"Robertson, J.H.B. & Shanks, A.M.",,Experiments with rigid grids in the Nephrops and whitefish fisheries. (04/97),01/01/1997
Scotland,,,1997,UFO,Fisheries Research Services,Internal Reports,,,FRS,,Biannual Review 1995-1997. (05/97) [no document available],01/01/1997
Scotland,,http://www.scotland.gov.uk/Uploads/Documents/IR0697.pdf,1997,3,Fisheries Research Services,Internal Reports,,,"Turrell, W.R.; Slesser, G. & Shelton, R.G.J.",,Hydrographic observations collected during the MLA 1997 summer post-smolt investigations. (06/97),01/01/1997
Scotland,,http://www.scotland.gov.uk/Uploads/Documents/IR0797.pdf,1997,1,Fisheries Research Services,Internal Reports,,,"Turrell, W.R.",,Examination of survey techniques using a simple method of a research vessel cruise. (07/97),01/01/1997
Scotland,,http://www.scotland.gov.uk/Uploads/Documents/IR0897.pdf,1997,5,Fisheries Research Services,Internal Reports,,,"Howell, T.R.W.; Davis, S.E.B.; Donald, J.W.; Bailey, N. & Chapman, C.J.",,Survey of Solway cockle grounds 1997. (08/97),01/01/1997
Scotland,,http://www.scotland.gov.uk/Uploads/Documents/IR0997.pdf,1997,3,Fisheries Research Services,Internal Reports,,,"Davies, I.M.; Minchin, A. & Harding, M.",,"OSPAR Working Group on Concentrations, Trends and Effects of Substances in the Marine Environment (SIME). Report on the TBT Training Workshop 24-26 September 1997. (09/97)",01/01/1997
Scotland,,http://www.scotland.gov.uk/Uploads/Documents/IR0198.pdf,1998,3,Fisheries Research Services,Internal Reports,,,"Howard, F.G.; Basford, D.J. & Graham, J.",,Preliminary trials to assess the viability of purifying the razor fish Ensis siliqua (L.) by depuration using ultra-violet sterilisation. (01/98),01/01/1998
Scotland,,http://www.scotland.gov.uk/Uploads/Documents/IR0298.pdf,1998,4,Fisheries Research Services,Internal Reports,,,"Bailey, N.; Howell, T.R.W.; Donald, J. & Davis, S.E.B.",,"Report of Marine Laboratory scallop workshop, 1997. (02/98)",01/01/1998
Scotland,,http://www.scotland.gov.uk/Uploads/Documents/IR0398.pdf,1998,2,Fisheries Research Services,Internal Reports,,,"Carter, T.J. & Hall, C.D.",,The effects of seismic exploration and underwater explosions on marine life: a bibliography. (03/98),01/01/1998
Scotland,,http://www.scotland.gov.uk/Uploads/Documents/IR0498.pdf,1998,2,Fisheries Research Services,Internal Reports,,,"Minchin, A. & Davies, I.M.",,Effect of sample handling on imposex measurement in the dogwhelk Nucella lapillus (L.). (04/98),01/01/1998
Scotland,,http://www.scotland.gov.uk/Uploads/Documents/IR0598.pdf,1998,2,Fisheries Research Services,Internal Reports,,,"Minchin, A. & Davies, I.M.",,Effect of freezing on penis length in Nucella lapillus (L.). (05/98),01/01/1998
Scotland,,,1998,3,Fisheries Research Services,Internal Reports,,,"Walker, A.F.; MacDonald, A.I. and Thorne, A.E.",,"The sea trout and brown trout spawning stocks of the Findhu Glen Burn, River Earn system, eastern Scotland in 1997. (06/98) [no document available]",01/01/1998
Scotland,,http://www.scotland.gov.uk/Uploads/Documents/IR0798.pdf,1998,7,Fisheries Research Services,Internal Reports,,,"Bailey, N.; Howell, T.R.W..; Davis, S.E.B.; Donald, J.W.; Fryer, R.; Heine, S. & Chapman, C.J.",,Survey of Solway cockle grounds 1998. (07/98),01/01/1998
Scotland,,http://www.scotland.gov.uk/Uploads/Documents/IR0898.pdf,1998,11,Fisheries Research Services,Internal Reports,,,"Bailey, N.; Breen, M.; Graham, N.; Howell, T.; Sangster, G.; Tuck, I.; Davis, S.; Donald, J.; Harding, M.; Kennedy, F. & Wright, P.",,A study of the effects of water jet dredging for razor clams and a stock survey of the target species in some Western Isles populations. (08/98),01/01/1998
Scotland,,http://www.scotland.gov.uk/Uploads/Documents/IR0998.pdf,1998,2,Fisheries Research Services,Internal Reports,,,"McKeown, S. & Hay, S.J.",,A preliminary investigation of the toxicity and sub-lethal effects of the sea lice control chemicals dichlorvos and ivermectin on survival and feeding of the marine copepod Acartia tonsa. (09/98),01/01/1998
Scotland,,http://www.scotland.gov.uk/Uploads/Documents/IR1198.pdf,1998,6,Fisheries Research Services,Internal Reports,,,"Webster, L.; McIntosh, A.D.; Moffat, C.F.; Dalgarno, E.J.; Brown, N.A. & Fryer, R.J.",,"Analysis of sediments, from Shetland Island Voes, for polycyclic aromatic hydrocarbons and biomarkers. (11/98)",01/01/1998
Scotland,,http://www.scotland.gov.uk/Uploads/Documents/IR1098.pdf,1998,2,Fisheries Research Services,Internal Reports,,,"Ferro, R.S.T. & Kynoch, R.J.",,Some evidence of age-related selectivity in haddock (10/98),01/01/1998
Scotland,,http://www.scotland.gov.uk/Uploads/Documents/0199.pdf,1999,2,Fisheries Research Services,Internal Reports,,,"Slesser, G. & Turrell, W.R.",,"Annual cycles of physical, chemical and biological parameters in Scottish waters (1999 update) (01/99)",01/04/1999
Scotland,,http://www.scotland.gov.uk/Uploads/Documents/IR0299.pdf,1999,2,Fisheries Research Services,Internal Reports,,,"Gillibrand, P.A. & Turrell, W.R.",,A management model to predict the dispersion of soluble pesticides from marine fish farms. (02/99),01/01/1999
Scotland,,http://www.scotland.gov.uk/Uploads/Documents/IR0399.pdf,1999,6,Fisheries Research Services,Internal Reports,,,"Howell, T.R.W.; Bailey, N.; Davis, S.E.B.; Donald, J.W.; Hawkins, M.J. & Chapman, C.J.",,Survey of Solway cockle grounds 1999. (03/99),01/01/1999
Scotland,,http://www.scotland.gov.uk/Uploads/Documents/0100INT.pdf,2000,3,Fisheries Research Services,Internal Reports,,,"Mormede, S.; Davies, I.M. & Gordon, J.D.M.",,Contaminants in deep water fish stocks third progress report: December 1999. (01/2000),01/01/2000
Scotland,,http://www.scotland.gov.uk/Uploads/Documents/0200INT.pdf,2000,2,Fisheries Research Services,Internal Reports,,,"O'Neill, S. & Moffat, C.F.",,A review of protein phosphatase inhibition assays and other available methods for the detection of diarrhetic shellfish toxins. (02/2000),01/01/2000
Scotland,,http://www.scotland.gov.uk/Uploads/Documents/0300INT.pdf,2000,2,Fisheries Research Services,Internal Reports,,,"Minchin, A. & Davies, I.M.",,"BEQUALM and QUASIMEME workshops on imposex and intersex in marine snails, Nucella lapillus, Baccinum undatum and Littorria littorria. Report on the TBT training workshop. (03/2000)",01/01/2000
Scotland,,http://www.scotland.gov.uk/Uploads/Documents/0400INT.pdf,2000,1,Fisheries Research Services,Internal Reports,,,"Needle, C.L.",,The in's and out's of ICA. (04/2000),01/01/2000
Scotland,,http://www.scotland.gov.uk/Uploads/Documents/0500INT.pdf,2000,1,Fisheries Research Services,Internal Reports,,,"Raynard, R.S.",,A survey of wild fish in Scotland for evidence of Infectious Salmon Anaemia Virus - Report for the period May 1998 to December 1999. (05/2000),01/01/2000
Scotland,,http://www.scotland.gov.uk/Uploads/Documents/IR0600.pdf,2000,1,Fisheries Research Services,Internal Reports,,,"Donaghy, M.J.",,The survival to hatch of salmon eggs in three locations within the Muick catchment. (06/2000),01/01/2000
Scotland,,http://www.scotland.gov.uk/Uploads/Documents/0700INT.pdf,2000,3,Fisheries Research Services,Internal Reports,,,"McIntosh, A.D.; Minchin, A. & Davies I.M.",,"BEQUALM, P4501A1 activity in fish liver, round one exercise report. (07/2000)",01/01/2000
Scotland,,,2000,1,Fisheries Research Services,Internal Reports,,,"Donaghy, M.J.",,"The occurrence of non-native fishes in a Dubh Lochan in Rannoch, Perthshire in 1999. (08/2000) [no document available]",01/01/2000
Scotland,,http://www.scotland.gov.uk/Uploads/Documents/0900.pdf,2000,3,Fisheries Research Services,Internal Reports,,,"Webster, L.; Wells, D. & Campbell, L.",,Chlorobiphenyl contaminants at Pladda and Garroch Head in the Firth of Clyde in relation to sewage sludge input. (09/2000),01/01/2000
